{
  "$schema": "https://json-schema.org/draft/2020-12/schema",
  "$id": "https://schemas.kumwe.org/studio/v1/design-vocabulary.schema.json",
  "title": "Studio design vocabulary contribution",
  "type": "object",
  "additionalProperties": false,
  "required": [
    "contractVersion",
    "kind",
    "id",
    "version",
    "owner",
    "label",
    "designControls",
    "recipes"
  ],
  "properties": {
    "contractVersion": { "$ref": "common.schema.json#/$defs/contractVersion" },
    "kind": { "const": "design-vocabulary" },
    "id": { "$ref": "common.schema.json#/$defs/qualifiedName" },
    "version": { "$ref": "common.schema.json#/$defs/semanticVersion" },
    "owner": { "$ref": "common.schema.json#/$defs/ownerReference" },
    "label": { "$ref": "common.schema.json#/$defs/messageReference" },
    "description": { "$ref": "common.schema.json#/$defs/messageReference" },
    "designControls": {
      "type": "array",
      "maxItems": 1000,
      "items": {
        "type": "object",
        "additionalProperties": false,
        "required": ["id", "kind", "label", "choices"],
        "properties": {
          "id": { "$ref": "common.schema.json#/$defs/localName" },
          "kind": {
            "enum": [
              "color-role",
              "typography-role",
              "spacing-role",
              "size-role",
              "radius-role",
              "shadow-role",
              "motion-role",
              "layer-role",
              "enum",
              "boolean",
              "integer"
            ]
          },
          "label": { "$ref": "common.schema.json#/$defs/messageReference" },
          "description": { "$ref": "common.schema.json#/$defs/messageReference" },
          "choices": {
            "type": "array",
            "minItems": 1,
            "maxItems": 500,
            "items": {
              "type": "object",
              "additionalProperties": false,
              "required": ["id", "label"],
              "properties": {
                "id": { "$ref": "common.schema.json#/$defs/localName" },
                "label": { "$ref": "common.schema.json#/$defs/messageReference" },
                "deprecated": { "type": "boolean" }
              }
            }
          }
        }
      }
    },
    "recipes": {
      "type": "array",
      "maxItems": 1000,
      "items": {
        "type": "object",
        "additionalProperties": false,
        "required": ["id", "blockType", "label", "designValues"],
        "properties": {
          "id": { "$ref": "common.schema.json#/$defs/localName" },
          "blockType": { "$ref": "common.schema.json#/$defs/qualifiedName" },
          "label": { "$ref": "common.schema.json#/$defs/messageReference" },
          "designValues": {
            "type": "object",
            "maxProperties": 100,
            "propertyNames": { "$ref": "common.schema.json#/$defs/localName" },
            "additionalProperties": { "$ref": "common.schema.json#/$defs/jsonValue" }
          }
        }
      }
    },
    "extensions": { "$ref": "common.schema.json#/$defs/extensions" }
  }
}
