{
  "contractVersion": "0.1-draft",
  "kind": "design-vocabulary",
  "id": "org.example.catalog/product-vocabulary",
  "version": "1.0.0",
  "owner": {
    "id": "org.example/catalog",
    "version": "1.0.0"
  },
  "label": {
    "key": "org.example.catalog/product-vocabulary",
    "defaultMessage": "Product design vocabulary"
  },
  "designControls": [
    {
      "id": "card-density",
      "kind": "enum",
      "label": {
        "key": "org.example.catalog/card-density",
        "defaultMessage": "Card density"
      },
      "choices": [
        {
          "id": "compact",
          "label": {
            "key": "org.example.catalog/card-density-compact",
            "defaultMessage": "Compact"
          }
        },
        {
          "id": "comfortable",
          "label": {
            "key": "org.example.catalog/card-density-comfortable",
            "defaultMessage": "Comfortable"
          }
        }
      ]
    },
    {
      "id": "card-width",
      "kind": "size-role",
      "label": {
        "key": "org.example.catalog/card-width",
        "defaultMessage": "Card width"
      },
      "choices": [
        {
          "id": "full",
          "label": {
            "key": "org.example.catalog/card-width-full",
            "defaultMessage": "Full"
          }
        },
        {
          "id": "half",
          "label": {
            "key": "org.example.catalog/card-width-half",
            "defaultMessage": "Half"
          }
        },
        {
          "id": "quarter",
          "label": {
            "key": "org.example.catalog/card-width-quarter",
            "defaultMessage": "Quarter"
          }
        }
      ]
    }
  ],
  "recipes": [
    {
      "id": "price-compact",
      "blockType": "org.example.catalog/price",
      "label": {
        "key": "org.example.catalog/price-compact",
        "defaultMessage": "Compact price"
      },
      "designValues": {
        "card-density": "compact",
        "card-width": "quarter"
      }
    }
  ]
}
